{
  "schema_version": "1.0.0",
  "job_id": "style-candidate-g-v2-orthographic-hachure",
  "image_path": "world/map-production/candidates/style-candidate-g-v2-orthographic-hachure.png",
  "created_at": "2026-07-19T05:52:00Z",
  "reviewer": "Independent Codex Vision QA A",
  "status": "complete",
  "golden_reference": false,
  "acceptance_threshold": 94,
  "review_views": [
    {"id": "overview", "label": "全体構図", "complete": true, "evidence": "Base, raw, protected final, guide, edit mask, protection mask, and automated composite report were inspected independently.", "notes": "The two main massifs read as dark relief patches, but four detached foothills do not survive as a six-part terrain hierarchy."},
    {"id": "original", "label": "原寸100%", "complete": true, "evidence": "The 1536x1024 final was inspected at native scale.", "notes": "Orthographic relief replaces the G1 scenic peaks, while long parallel bands and road-shaped quiet channels are already visible."},
    {"id": "zoom", "label": "200%・400%拡大", "complete": true, "evidence": "Twenty final/raw diagnostic crops under tmp/map-production/g2-review-v1 were inspected at original detail.", "notes": "Magnification exposes fingerprint-like repetition, missing foothill structure, and abrupt hachure termination beside protected roads."},
    {"id": "nine_regions", "label": "中央・四隅・四辺の9領域", "complete": true, "evidence": "The full final and 8x amplified base/final difference were scanned across all edges and regions.", "notes": "All four outer borders are unchanged; the defects are confined to the intended north-east and south-east relief areas."},
    {"id": "control_overlay", "label": "制御図との半透明重ね合わせ", "complete": true, "evidence": "The six-component topology guide, final difference, edit mask, protection mask, and per-component difference statistics were compared.", "notes": "NE-west and SE-east foothills retain only 17.7% and 15.2% of pixels above a 5-level mean difference; all four foothills fail reliable independent recognition."},
    {"id": "parent_zoom", "label": "親ズーム画像との比較", "complete": true, "evidence": "Candidate D v4 and G2 were compared at matching extents and reduced visual scale.", "notes": "Palette and paper texture continue, but the massifs collapse into dark patches and the foothills disappear at parent scale."},
    {"id": "neighbor_seams", "label": "四方向の隣接合成", "complete": true, "evidence": "All outer border differences are zero and north-east/south-east edge crops were inspected.", "notes": "No canvas-edge clipping remains, but internal road guards create visible terrain discontinuities that read as mask seams."},
    {"id": "vector_overlay", "label": "ベクターラベル・道路・POI重畳", "complete": true, "evidence": "Roads, city wall, coast, fields, trees, future label quiet space, and protected-pixel evidence were reviewed.", "notes": "Protected linework remains exact, while dense repetitive relief competes with labels and broad road-shaped gaps call attention to the mask."},
    {"id": "desktop", "label": "Leafletデスクトップ表示", "complete": true, "evidence": "Desktop suitability was assessed from the native overview and 200% crops; staging was stopped by hard image failures.", "notes": "Main relief is legible but reads as repeated contour bands rather than a detailed historical terrain layer."},
    {"id": "mobile", "label": "Leafletモバイル表示", "complete": true, "evidence": "Mobile suitability was assessed from the full overview at reduced visual scale; staging was stopped by hard image failures.", "notes": "Only two dark massifs remain, so the six-landform topology is lost."}
  ],
  "immediate_failures": [
    {"id": "geometry_shift", "label": "海岸線・河川・主要道路・城壁の移動", "detected": false, "evidence": "Automated gates and visual comparison show zero changed pixels outside permission, on road cores, on detail cores, and on all four canvas borders."},
    {"id": "missing_required", "label": "必須地点・地形の欠落", "detected": true, "evidence": "Only the two main massifs are reliable; the four required detached foothills are absent or merge into existing rock texture at 100%, 200%, and 400%."},
    {"id": "noncanon_major", "label": "正典外の主要都市・施設", "detected": false, "evidence": "No new city, facility, road, or major landmark was introduced."},
    {"id": "generated_text", "label": "AI生成文字・記号", "detected": false, "evidence": "No words, pseudo-writing, compass, scale bar, legend, signature, or route-like generated marks were found."},
    {"id": "visible_seam", "label": "目視できる継ぎ目", "detected": true, "evidence": "Protected road corridors appear as broad flat channels where hachures stop abruptly, producing mask-derived halos and terrain cuts."},
    {"id": "modern_or_watermark", "label": "現代物・透かし・署名", "detected": false, "evidence": "No modern object, watermark, logo, or signature was found."},
    {"id": "perspective_jump", "label": "遠近法化・縮尺の急変", "detected": false, "evidence": "No triangular scenic peaks, side faces, directional cast shadows, horizon, or oblique projection remain."},
    {"id": "repetition", "label": "建物・樹木・岩の不自然な反復", "detected": true, "evidence": "Long, evenly spaced, near-parallel wavy lines repeat across both massifs and read as fingerprint or contour bands instead of short irregular fall-line hachures."}
  ],
  "scores": [
    {"id": "canon_geometry", "label": "正典・地形形状との一致", "maximum": 25, "score": 14, "notes": "Protected canon is exact, but four foothills and clear saddle hierarchy are missing."},
    {"id": "parent_continuity", "label": "親子ズームの連続性", "maximum": 15, "score": 6, "notes": "Palette continues; main relief collapses into dark patches and foothills disappear when reduced."},
    {"id": "seam_continuity", "label": "隣接画像の継ぎ目", "maximum": 15, "score": 9, "notes": "Outer edges are exact, but protected road corridors visibly sever the relief."},
    {"id": "style_consistency", "label": "画風・色・線密度", "maximum": 15, "score": 10, "notes": "Strict plan view is successful; continuous regular waves violate the requested short irregular hachure grammar."},
    {"id": "detail_density", "label": "縮尺相応の情報量", "maximum": 10, "score": 4, "notes": "Two massifs are over-dense while the four secondary landforms are too faint."},
    {"id": "artifact_integrity", "label": "生成破綻・反復模様", "maximum": 10, "score": 2, "notes": "Fingerprint-like repetition and mask-derived road channels are dominant artifacts."},
    {"id": "vector_readability", "label": "ベクター重畳時の可読性", "maximum": 10, "score": 6, "notes": "Exact protection helps, but dense repeated bands compete with labels and POIs."}
  ],
  "total_score": 51,
  "decision": "rejected",
  "summary": "G2 removes G1 perspective and edge clipping, but is rejected because four required foothills disappear, long uniform contour-like bands repeat across both massifs, and protected roads read as flat mask channels.",
  "required_changes": [
    "Replace long continuous parallel waves with short, broken, unequal fall-line strokes while keeping the orthographic viewpoint, base, palette, and protected canon fixed.",
    "Use a deterministic six-landform hachure skeleton so every foothill, two-lobe massif, and quiet saddle exists in the raw generation before compositing."
  ]
}
