{
  "schema_version": "1.0.0",
  "job_id": "style-candidate-h-v17-surgical-flattening",
  "image_path": "world/map-production/candidates/style-candidate-h-v17-surgical-flattening-raw.png",
  "created_at": "2026-07-19T20:42:48.591Z",
  "reviewer": "codex-vision-qa-a-independent",
  "status": "complete",
  "golden_reference": false,
  "acceptance_threshold": 94,
  "review_views": [
    {
      "id": "overview",
      "label": "全体構図",
      "complete": true,
      "evidence": "H17 SHA-256 5eeee266f37ab418a4b136a6d66e67ccfe9268fa04a18cf7e96323e9b7d1506f、1536×1024 RGBを全景確認。",
      "notes": "海岸、島群、デルタ、首都、港、農地、主要道路・河川の大配置は維持されている。一方、画面全域が暗く均質な高周波模様で覆われ、H4の縮尺階層と静穏部が失われている。"
    },
    {
      "id": "original",
      "label": "原寸100%",
      "complete": true,
      "evidence": "原寸で海面、森林、東・南高地、都市、港、農地、道路、河川を走査。",
      "notes": "線は概ね解像しているが、水面の輪状模様、高地の記号状の落書き、森林の類似樹冠が全面反復している。"
    },
    {
      "id": "scale_25",
      "label": "25%縮小",
      "complete": true,
      "evidence": "384×256相当で全景を確認。",
      "notes": "首都・港・水系の大構造は読めるが、道路が薄くなり、森林と高地が細密情報ではなく均質なノイズ面として融合する。"
    },
    {
      "id": "scale_50",
      "label": "50%縮小",
      "complete": true,
      "evidence": "768×512相当で全景を確認。",
      "notes": "主要地物は識別可能。ただし、東・南高地の密度が過剰で、ベクターや小ラベルのための静穏領域が不足する。"
    },
    {
      "id": "zoom_200",
      "label": "200%拡大",
      "complete": true,
      "evidence": "3×3全領域を個別に200%相当で確認。",
      "notes": "水面の鎖状・環状パターン、森林の類似した丸い樹冠、高地の反復する山形・渦形・点列が明瞭になった。"
    },
    {
      "id": "zoom_400",
      "label": "400%拡大",
      "complete": true,
      "evidence": "首都、港、東高地、南高地、四隅を400%相当で確認。",
      "notes": "首都外壁・塔・中央施設と港の桟橋端に立体側面が残る。高地は自然な破線ハッチ・点描ではなく、連続する疑似記号の絨毯状テクスチャである。"
    },
    {
      "id": "region_nw",
      "label": "北西領域",
      "complete": true,
      "evidence": "外洋と北西海岸を200%で確認。",
      "notes": "海面全体に同寸法の輪郭ループが反復する。海岸位置は概ね保たれるが、複数の平行波線が強すぎる。"
    },
    {
      "id": "region_n",
      "label": "北中央領域",
      "complete": true,
      "evidence": "北部森林と河川を200%で確認。",
      "notes": "河川は連続するが、森林は丸い樹冠と縦方向の幹状線が反復し、自然な個体差よりパターン性が勝る。"
    },
    {
      "id": "region_ne",
      "label": "北東領域",
      "complete": true,
      "evidence": "北東の岩地・道路・樹木を200%で確認。",
      "notes": "道路は通るが、地表が渦、楕円、小三角、短線の均一な高密度反復で埋まり、自然な空隙がない。"
    },
    {
      "id": "region_w",
      "label": "西中央領域",
      "complete": true,
      "evidence": "外洋、島群、デルタ西端を200%で確認。",
      "notes": "島群と水路の大形状は維持される。海面と島内の反復模様、および海岸沿いの多重輪郭が目立つ。"
    },
    {
      "id": "region_center",
      "label": "中央領域",
      "complete": true,
      "evidence": "首都、放射道路、デルタ接続部を200%で確認。",
      "notes": "放射構成は維持されるが、外壁下半分の石積み側面、円塔の垂直側面、中央の尖塔状施設が真上視点に反する。"
    },
    {
      "id": "region_e",
      "label": "東中央領域",
      "complete": true,
      "evidence": "東高地、横断道路、農地北縁を200%で確認。",
      "notes": "横断道路は連続する。高地には山形・鋸歯状の短い記号列が繰り返され、ベクター余白を侵食している。"
    },
    {
      "id": "region_sw",
      "label": "南西領域",
      "complete": true,
      "evidence": "港、海面、南西外周を200%で確認。",
      "notes": "港街路は平面格子だが、桟橋が二重線の梁、立ち上がった端柱、垂直支持物を持ち、明確な立体表現である。"
    },
    {
      "id": "region_s",
      "label": "南中央領域",
      "complete": true,
      "evidence": "南部岩地、河川、道路、海岸を200%で確認。",
      "notes": "道路・河川は概ね連続するが、岩地は小三角と巻き模様が反復し、自然な地形材質や静穏部として成立していない。"
    },
    {
      "id": "region_se",
      "label": "南東領域",
      "complete": true,
      "evidence": "農地、幹線道路、南東外周を200%で確認。",
      "notes": "農地区画と道路は読める。周囲の落書き状地表模様と反復樹木が背景密度を過剰にしている。"
    },
    {
      "id": "capital_focus",
      "label": "円形首都",
      "complete": true,
      "evidence": "首都を400%で確認。",
      "notes": "街区足跡は読めるが、外壁の下向き側面、円塔の円柱側面、中央尖塔と陰影が残り、要求された厳密な垂直平面図ではない。"
    },
    {
      "id": "port_focus",
      "label": "南西港",
      "complete": true,
      "evidence": "港を400%で確認。",
      "notes": "街路格子は平面的だが、桟橋は中心線ではなく幅と立体端柱を持つ構造物として描かれ、水面との接触も斜視的である。"
    },
    {
      "id": "east_highland_focus",
      "label": "東高地",
      "complete": true,
      "evidence": "東高地を400%で確認。",
      "notes": "大きな峰は除去されたが、微細な山形、渦形、楕円、点列が全面に反復し、指定された不規則な破線ハッチ・点描・密度差・自然な空隙を満たさない。"
    },
    {
      "id": "south_highland_focus",
      "label": "南高地",
      "complete": true,
      "evidence": "南高地を400%で確認。",
      "notes": "東高地と同じ記号状テクスチャが繰り返され、材質の自然変化と静穏部がない。小三角形は依然として縮小山岳記号に見える。"
    },
    {
      "id": "coast_delta_focus",
      "label": "海岸・デルタ",
      "complete": true,
      "evidence": "西海岸、島群、デルタを200%で確認。",
      "notes": "主要海岸線と水路は保たれるが、海岸に4～6本程度の平行波線が重なり、低い平面境界としては過剰である。"
    },
    {
      "id": "forest_focus",
      "label": "森林",
      "complete": true,
      "evidence": "北部森林を200%で確認。",
      "notes": "多くの樹木に丸い樹冠、縦の幹状線、一定方向の濃淡があり、真上視点より正面・斜視の樹木記号に見える。"
    },
    {
      "id": "roads_focus",
      "label": "道路網",
      "complete": true,
      "evidence": "首都放射路、東西幹線、南部湾曲路、港接続路を追跡。",
      "notes": "確認範囲では主要道路の破断はなく、交差・接続も概ね維持される。背景密度が細い道路の視認性を低下させる。"
    },
    {
      "id": "rivers_focus",
      "label": "河川網",
      "complete": true,
      "evidence": "北部河川、合流点、デルタ分流、南西流路を追跡。",
      "notes": "主要河川とデルタ分流は連続し、明白な破断はない。水面の反復模様が流路内にも入り、流向階層を弱める。"
    },
    {
      "id": "edge_seams",
      "label": "四辺・四隅・継ぎ目",
      "complete": true,
      "evidence": "四隅を400%、四辺を全景および9分割で確認。",
      "notes": "枠、直線的な切替、矩形パッチ、継ぎ目は見つからず、外周は連続可能。ただし水面・地表の反復模様は端まで続く。"
    },
    {
      "id": "h4_parent_comparison",
      "label": "H4親画像との比較",
      "complete": true,
      "evidence": "H4 SHA-256 b4fc951af5d29c78bb98b5ee5007395b5fc3c1addc7070d76ac8074545259837と全景・非対象領域を比較。全画面MAE 18.290、PSNR 20.28 dB、±5以内4.154%。非対象の外洋MAE 10.343、北森林17.548、農地18.477。",
      "notes": "編集対象外の海面、森林、農地まで色・粒子・線構造が全面的に再生成されており、「影響のない素材をH4と視覚的に同一」にする外科的編集条件を満たさない。"
    },
    {
      "id": "b1_comparison",
      "label": "Candidate B1画風との比較",
      "complete": true,
      "evidence": "B1 SHA-256 4d505def78acc752ee2611cb73d112cc9a3048f611cb05233274a1eb2ae42003と全景・材質を比較。",
      "notes": "セピア地と青灰水面の大配色は系統を保つが、B1/H4の自然な銅版画線、色域、素材階層より暗く均質で、記号状ノイズが支配的である。"
    },
    {
      "id": "network_vector_readability",
      "label": "道路・河川・ベクター重畳余白",
      "complete": true,
      "evidence": "道路・河川の全経路と、海面、首都周辺、東・南高地、農地周辺の重畳余白を確認。",
      "notes": "主要ネットワーク自体は追跡可能だが、高地・森林・開放地まで高周波テクスチャで埋まり、ラベル、境界線、POI、ルート強調用の静穏回廊が不足する。"
    }
  ],
  "immediate_failures": [
    {
      "id": "generated_text",
      "label": "文字・偽文字",
      "detected": false,
      "evidence": "全景、原寸、200%、400%で確認し、文章、ラベル、読める文字列、言語状の偽文字列は見つからなかった。"
    },
    {
      "id": "watermark_frame_modern",
      "label": "透かし・枠・現代物",
      "detected": false,
      "evidence": "透かし、署名、UI、現代物、外周フレームは見つからなかった。"
    },
    {
      "id": "floating_underside",
      "label": "浮島下面",
      "detected": false,
      "evidence": "全島は水面に接しており、浮遊岩下面や宙に浮く陸塊はない。"
    },
    {
      "id": "side_face_perspective_lighting",
      "label": "側面・遠近法・方向光",
      "detected": true,
      "evidence": "400%で首都外壁下半分の石積み側面、円塔の円柱側面、中央尖塔、港桟橋の垂直端柱・支持物を確認。森林にも幹状の垂直線と一定方向の陰影が残る。"
    },
    {
      "id": "missing_required",
      "label": "必須構成・指定表現の欠落",
      "detected": true,
      "evidence": "要求された首都・港の真上視点の足跡／中庭／桟橋中心線、および高地の不規則ハッチ・点描・密度変化・自然な空隙が成立していない。編集対象外をH4と視覚的同一に保つ条件も欠落している。"
    },
    {
      "id": "broken_network",
      "label": "道路・河川破断",
      "detected": false,
      "evidence": "主要放射道路、東西幹線、港接続路、北部河川、合流点、デルタ分流を追跡し、明白な破断は確認しなかった。"
    },
    {
      "id": "repetition",
      "label": "樹木・岩・水面・記号の不自然な反復",
      "detected": true,
      "evidence": "200～400%で、水面全域の輪状・鎖状模様、東・南高地の渦・楕円・三角・点列、森林の類似樹冠が広範囲かつ均一に反復している。"
    },
    {
      "id": "visible_edge_seam",
      "label": "目立つ端継ぎ目",
      "detected": false,
      "evidence": "四辺・四隅に矩形パッチ境界、直線的な色変化、フレーム、明白な編集継ぎ目は見つからなかった。"
    }
  ],
  "scores": [
    {
      "id": "prompt_geometry",
      "label": "Prompt構成・厳密平面性",
      "maximum": 25,
      "score": 12,
      "notes": "大配置とネットワークは概ね維持され、大峰も除去された。しかし首都・港には明確な側面が残り、高地材質、海岸処理、外科的編集範囲の条件を満たさない。"
    },
    {
      "id": "parent_style_continuity",
      "label": "親画像・Candidate B1画風連続性",
      "maximum": 15,
      "score": 8,
      "notes": "大配色は同系統だが、非対象領域まで暗色化・再粒状化され、H4/B1の自然な銅版画材質と縮尺階層から大きく離れる。"
    },
    {
      "id": "edge_seam_continuity",
      "label": "端部・継ぎ目連続性",
      "maximum": 15,
      "score": 15,
      "notes": "外枠、矩形パッチ、切替線はなく、四辺・四隅は連続可能である。"
    },
    {
      "id": "style_consistency",
      "label": "画風・色・線密度",
      "maximum": 15,
      "score": 9,
      "notes": "一枚の絵として色調は統一されるが、過剰な均質ノイズ、疑似記号状地表、立体都市・港が求める平面地図文法と競合する。"
    },
    {
      "id": "detail_density",
      "label": "縮尺相応の情報量",
      "maximum": 10,
      "score": 6,
      "notes": "細部量は多いが、25～50%で階層化された情報ではなくノイズへ収束し、自然な空隙と焦点差が不足する。"
    },
    {
      "id": "artifact_nonrepetition",
      "label": "生成破綻・非反復性",
      "maximum": 10,
      "score": 1,
      "notes": "水面、高地、森林に広域で明白な意味的反復があり、今回の最大の即時不合格要因である。"
    },
    {
      "id": "vector_readability",
      "label": "ベクター重畳時の可読性",
      "maximum": 10,
      "score": 4,
      "notes": "道路・河川は追跡できるが、首都周辺、高地、森林、開放地の背景密度が高く、ラベル・境界・POI用の静穏回廊が不足する。"
    }
  ],
  "total_score": 55,
  "decision": "rejected",
  "summary": "H17は主要な海岸・島群・デルタ・道路・河川・都市配置と枠なし外周を保っているが、首都外壁・塔・中央施設および港桟橋に側面と高さ表現が残る。さらに水面、高地、森林が広域の反復記号状テクスチャへ変質し、編集対象外もH4から全面的に変わっている。即時不合格条件を複数検出したため、55点で不採用。",
  "required_changes": [
    "首都外壁、円塔、中央施設を円・多角形・街区足跡だけの真上視点へ置換し、垂直側面、尖塔、方向陰影を完全に除去する。",
    "港桟橋を単純な平面中心線または一定幅の上面輪郭へ置換し、端柱、支持物、側面、斜視的な水面接触を除去する。",
    "東・南高地の渦・楕円・三角・点列の反復を除き、非周期的な短い破線ハッチと点描、密度差、十分な自然空隙で再構成する。",
    "外洋、森林、農地、道路、河川など編集対象外はH4の画素または保護領域をそのまま保持し、全域再生成を行わない。",
    "H4の自然な水面線、銅版画材質、明暗階層、ベクター用静穏回廊を復元し、海岸の過剰な多重平行線を低い平面境界へ整理する。"
  ]
}
